cluster,keyword_count,keywords
editor&#8217;s choice,4,Editor&#8217;s choice | Editor&#8217;s Choice | Editor&#8217;s choice | Editor&#8217;s Choice
latest posts,2,Latest Posts | Latest Posts
recent newstay,2,Recent NewStay up-to-date | Recent NewStay up-to-date
features of,2,Features of Luxury Apartments in New York City | Features of Luxury NYC Penthouses
renting vs,2,Renting vs Buying Luxury Apartments in NYC | Renting vs Buying a Penthouse in NYC
new york,1,New York luxury
nyc luxury,1,NYC luxury lifestyle
ny high,1,NY high end
manhattan luxury,1,Manhattan luxury
luxury new,1,luxury New York real estate
artemis ii:,1,Artemis II: A Historic Return to the Moon
artemis program:,1,Artemis Program: Building a Sustainable Lunar Future
moon to,1,Moon to Mars: The Next Giant Leap
robotic missions,1,Robotic Missions and Lunar Innovation
gateway and,1,Gateway and Deep Space Infrastructure
commercial partnerships,1,Commercial Partnerships and Private Space Industry
scientific discoveries,1,Scientific Discoveries and Research Goals
challenges and,1,Challenges and Future Outlook
posts pagination,1,Posts pagination
why luxury,1,Why Luxury Apartments in NYC Are So Expensive
average rent,1,Average Rent Prices of Luxury Apartments in NYC (2026)
best areas,1,Best Areas to Rent Luxury Apartments in NYC
types of,1,Types of Luxury Apartments in NYC
tips for,1,Tips for Finding the Best Luxury Apartment in NYC
lifestyle of,1,Lifestyle of Living in a NYC Luxury Apartment
what makes,1,What Makes NYC Penthouses So Luxurious
top locations,1,Top Locations for Penthouses in New York City
skyline views,1,Skyline Views and Architecture of NYC Penthouses
most expensive,1,Most Expensive NYC Penthouses in 2026
famous celebrity,1,Famous Celebrity Penthouses in New York
how much,1,How Much Do NYC Penthouses Cost
