cluster,keyword_count,keywords
selected media,14,Selected media actions | Selected media actions | Selected media actions | Selected media actions | Selected media actions | Selected media actions | Selected media actions | Selected media actions | Selected media actions | Selected media actions | Selected media actions | Selected media actions | Selected media actions | Selected media actions
{{ data.message,14,{{ data.message }} | {{ data.message }} | {{ data.message }} | {{ data.message }} | {{ data.message }} | {{ data.message }} | {{ data.message }} | {{ data.message }} | {{ data.message }} | {{ data.message }} | {{ data.message }} | {{ data.message }} | {{ data.message }} | {{ data.message }}
drop files,10,Drop files to upload | Drop files to upload | Drop files to upload | Drop files to upload | Drop files to upload | Drop files to upload | Drop files to upload | Drop files to upload | Drop files to upload | Drop files to upload
attachment preview,7,Attachment Preview | Attachment Preview | Attachment Preview | Attachment Preview | Attachment Preview | Attachment Preview | Attachment Preview
posts pagination,5,Posts pagination | Posts pagination | Posts pagination | Posts pagination | Posts pagination
guarding the,3,Guarding the King of the Blues: Vassal Benford&#8217;s Role... | Guarding the King of the Blues: Vassal Benford&#8217;s Role... | Guarding the King of the Blues: Vassal Benford&#8217;s Role...
las vegas,2,Las Vegas news | Las Vegas events
analyzing the,2,Analyzing the Convergence of Legacy Finance and Distributed... | Analyzing the Convergence of Legacy Finance and Distributed...
tackling modern,2,Tackling Modern Cloud Constraints With Workload-Specific... | Tackling Modern Cloud Constraints With Workload-Specific...
bridging the,2,Bridging the Protein Production Gap: Inside Dyadic&#8217;s... | Bridging the Protein Production Gap: Inside Dyadic&#8217;s...
inside the,2,Inside the Mind of a Master Procrastinator | Inside the Mind of a Master Procrastinator
attachment details,2,"Attachment Details			
				
				Saved. | Attachment Details			
				
				Saved."
vegas business,1,Vegas business
vegas entertainment,1,Vegas entertainment
nevada news,1,Nevada news
from mindset,1,From Mindset to Execution: The Business Coaching Framework...
navigating the,1,Navigating the Shift to Blockchain Infrastructure With...
preserving the,1,Preserving the Blues: Vassal Benford&#8217;s Vision for the...
unlocking achievement:,1,Unlocking Achievement: The Methods and Mentorship of Omar...
a legacy,1,A Legacy Built on Books and Accolades
practical strategies,1,Practical Strategies for Real-World Challenges
praise from,1,Praise from Industry Icons
empowering the,1,Empowering the Next Wave of Leaders
connecting established,1,Connecting Established Markets with Decentralized Frameworks
the critical,1,The Critical Role of Governance and Trust
shifting dynamics,1,Shifting Dynamics in Digital Asset Treasuries
wall street,1,Wall Street Adopts On-Chain Architecture
navigating evolving,1,Navigating Evolving Regulatory Standards
rooted in,1,Rooted in Capital Formation Experience
the future,1,The Future of Financial Architecture
from rydeum,1,From Rydeum Incubator to NexQloud
core platform,1,Core Platform Offerings
patents and,1,Patents and Compliance Standards
addressing production,1,Addressing Production Bottlenecks
a multi-faceted,1,A Multi-Faceted Business Approach
applications across,1,Applications Across Diverse Sectors
key milestones,1,Key Milestones Ahead
disclosure and,1,Disclosure and Advertising Notice
expanding a,1,Expanding a Cultural Legacy
the kings,1,The Kings Crossing Bridge Venture
transcending traditional,1,Transcending Traditional Entertainment Leadership
